[
  {
    "变量ID": "VAR-G11-001",
    "变量名": "g11_intro_done",
    "类型": "bool",
    "默认值": "false",
    "写入条件": "首场景完成",
    "持久性": "保存",
    "约束": "无"
  },
  {
    "变量ID": "VAR-G11-002",
    "变量名": "g11_mech_1_done",
    "类型": "bool",
    "默认值": "false",
    "写入条件": "三视图装配完成",
    "持久性": "保存",
    "约束": "权限条件"
  },
  {
    "变量ID": "VAR-G11-003",
    "变量名": "g11_mech_2_done",
    "类型": "bool",
    "默认值": "false",
    "写入条件": "空间装箱线完成",
    "持久性": "保存",
    "约束": "权限条件"
  },
  {
    "变量ID": "VAR-G11-004",
    "变量名": "g11_mech_3_done",
    "类型": "bool",
    "默认值": "false",
    "写入条件": "受力分散阵完成",
    "持久性": "保存",
    "约束": "权限条件"
  },
  {
    "变量ID": "VAR-G11-005",
    "变量名": "g11_mech_4_done",
    "类型": "bool",
    "默认值": "false",
    "写入条件": "关节避障序列完成",
    "持久性": "保存",
    "约束": "权限条件"
  },
  {
    "变量ID": "VAR-G11-006",
    "变量名": "g11_story_failure_seen",
    "类型": "bool",
    "默认值": "false",
    "写入条件": "剧情性失败发生",
    "持久性": "保存",
    "约束": "必须发生"
  },
  {
    "变量ID": "VAR-G11-007",
    "变量名": "g11_evidence_1",
    "类型": "bool",
    "默认值": "false",
    "写入条件": "取得或验证证据",
    "持久性": "保存",
    "约束": "无"
  },
  {
    "变量ID": "VAR-G11-008",
    "变量名": "g11_evidence_2",
    "类型": "bool",
    "默认值": "false",
    "写入条件": "取得或验证证据",
    "持久性": "保存",
    "约束": "无"
  },
  {
    "变量ID": "VAR-G11-009",
    "变量名": "g11_evidence_3",
    "类型": "bool",
    "默认值": "false",
    "写入条件": "取得或验证证据",
    "持久性": "保存",
    "约束": "无"
  },
  {
    "变量ID": "VAR-G11-010",
    "变量名": "g11_evidence_4",
    "类型": "bool",
    "默认值": "false",
    "写入条件": "取得或验证证据",
    "持久性": "保存",
    "约束": "无"
  },
  {
    "变量ID": "VAR-G11-011",
    "变量名": "g11_evidence_5",
    "类型": "bool",
    "默认值": "false",
    "写入条件": "取得或验证证据",
    "持久性": "保存",
    "约束": "无"
  },
  {
    "变量ID": "VAR-G11-012",
    "变量名": "g11_evidence_6",
    "类型": "bool",
    "默认值": "false",
    "写入条件": "取得或验证证据",
    "持久性": "保存",
    "约束": "无"
  },
  {
    "变量ID": "VAR-G11-013",
    "变量名": "g11_evidence_7",
    "类型": "bool",
    "默认值": "false",
    "写入条件": "取得或验证证据",
    "持久性": "保存",
    "约束": "无"
  },
  {
    "变量ID": "VAR-G11-014",
    "变量名": "g11_evidence_8",
    "类型": "bool",
    "默认值": "false",
    "写入条件": "取得或验证证据",
    "持久性": "保存",
    "约束": "无"
  },
  {
    "变量ID": "VAR-G11-015",
    "变量名": "g11_evidence_9",
    "类型": "bool",
    "默认值": "false",
    "写入条件": "取得或验证证据",
    "持久性": "保存",
    "约束": "无"
  },
  {
    "变量ID": "VAR-G11-016",
    "变量名": "g11_evidence_10",
    "类型": "bool",
    "默认值": "false",
    "写入条件": "取得或验证证据",
    "持久性": "保存",
    "约束": "无"
  },
  {
    "变量ID": "VAR-G11-017",
    "变量名": "g11_permission_1",
    "类型": "bool",
    "默认值": "false",
    "写入条件": "管理员权限节点完成",
    "持久性": "保存",
    "约束": "权限1"
  },
  {
    "变量ID": "VAR-G11-018",
    "变量名": "g11_permission_2",
    "类型": "bool",
    "默认值": "false",
    "写入条件": "管理员权限节点完成",
    "持久性": "保存",
    "约束": "权限2"
  },
  {
    "变量ID": "VAR-G11-019",
    "变量名": "g11_permission_3",
    "类型": "bool",
    "默认值": "false",
    "写入条件": "管理员权限节点完成",
    "持久性": "保存",
    "约束": "权限3"
  },
  {
    "变量ID": "VAR-G11-020",
    "变量名": "g11_permission_4",
    "类型": "bool",
    "默认值": "false",
    "写入条件": "管理员权限节点完成",
    "持久性": "保存",
    "约束": "权限4"
  },
  {
    "变量ID": "VAR-G11-021",
    "变量名": "g11_admin_unlocked",
    "类型": "bool",
    "默认值": "false",
    "写入条件": "管理员权限解除",
    "持久性": "跨章保存",
    "约束": "无"
  },
  {
    "变量ID": "VAR-G11-022",
    "变量名": "g11_world_change_checks",
    "类型": "int",
    "默认值": "0",
    "写入条件": "世界改变回访",
    "持久性": "保存",
    "约束": "0-3"
  },
  {
    "变量ID": "VAR-G11-023",
    "变量名": "g11_chapter_complete",
    "类型": "bool",
    "默认值": "false",
    "写入条件": "章节结算",
    "持久性": "跨章保存",
    "约束": "解锁G12"
  },
  {
    "变量ID": "VAR-G11-024",
    "变量名": "world_star_core_count",
    "类型": "int",
    "默认值": "9",
    "写入条件": "章节完成",
    "持久性": "跨章保存",
    "约束": "完成后+1"
  },
  {
    "变量ID": "VAR-G11-025",
    "变量名": "player_name",
    "类型": "string",
    "默认值": "星宇",
    "写入条件": "全项目固定",
    "持久性": "跨章保存",
    "约束": "禁止写回小砾"
  },
  {
    "变量ID": "VAR-G11-026",
    "变量名": "g11_hint_level",
    "类型": "int",
    "默认值": "0",
    "写入条件": "失败次数更新",
    "持久性": "临时+保存",
    "约束": "0-3"
  },
  {
    "变量ID": "VAR-G11-027",
    "变量名": "g11_last_safe_node",
    "类型": "string",
    "默认值": "无",
    "写入条件": "进入安全节点",
    "持久性": "保存",
    "约束": "恢复位置"
  },
  {
    "变量ID": "VAR-G11-028",
    "变量名": "g11_inventory_valid",
    "类型": "bool",
    "默认值": "true",
    "写入条件": "每次保存前校验",
    "持久性": "保存",
    "约束": "关键物完整"
  },
  {
    "变量ID": "VAR-G11-029",
    "变量名": "g11_ending_flag",
    "类型": "string",
    "默认值": "未完成",
    "写入条件": "章节结算",
    "持久性": "跨章保存",
    "约束": "完成/分支"
  }
]