[
  {
    "变量ID": "VAR-G05-001",
    "变量名": "g05_landing_calibrated",
    "类型": "bool",
    "默认值": "false",
    "写入条件": "双高度完成",
    "持久性": "保存",
    "约束": "无"
  },
  {
    "变量ID": "VAR-G05-002",
    "变量名": "g05_current_standard",
    "类型": "bool",
    "默认值": "false",
    "写入条件": "尺林标准完成",
    "持久性": "保存",
    "约束": "无"
  },
  {
    "变量ID": "VAR-G05-003",
    "变量名": "g05_water_minimum_locked",
    "类型": "bool",
    "默认值": "false",
    "写入条件": "最低保障完成",
    "持久性": "保存",
    "约束": "无"
  },
  {
    "变量ID": "VAR-G05-004",
    "变量名": "g05_station_drained",
    "类型": "bool",
    "默认值": "false",
    "写入条件": "排水阀完成",
    "持久性": "保存",
    "约束": "无"
  },
  {
    "变量ID": "VAR-G05-005",
    "变量名": "g05_bridge_first_failure",
    "类型": "bool",
    "默认值": "false",
    "写入条件": "错位剧情发生",
    "持久性": "保存",
    "约束": "必须发生"
  },
  {
    "变量ID": "VAR-G05-006",
    "变量名": "g05_bridge_board_damage",
    "类型": "int",
    "默认值": "0",
    "写入条件": "第一次失败",
    "持久性": "跨章保存",
    "约束": "0-2"
  },
  {
    "变量ID": "VAR-G05-007",
    "变量名": "g05_ice_thickness_points",
    "类型": "int",
    "默认值": "0",
    "写入条件": "厚度探测",
    "持久性": "保存",
    "约束": "0-3"
  },
  {
    "变量ID": "VAR-G05-008",
    "变量名": "g05_weight_balance_ready",
    "类型": "bool",
    "默认值": "false",
    "写入条件": "配重完成",
    "持久性": "保存",
    "约束": "无"
  },
  {
    "变量ID": "VAR-G05-009",
    "变量名": "g05_safety_rope_ready",
    "类型": "bool",
    "默认值": "false",
    "写入条件": "安全绳固定",
    "持久性": "保存",
    "约束": "无"
  },
  {
    "变量ID": "VAR-G05-010",
    "变量名": "g05_safe_route_done",
    "类型": "bool",
    "默认值": "false",
    "写入条件": "UI-027完成",
    "持久性": "保存",
    "约束": "权限条件"
  },
  {
    "变量ID": "VAR-G05-011",
    "变量名": "g05_rail_installed",
    "类型": "bool",
    "默认值": "false",
    "写入条件": "滑轨完成",
    "持久性": "保存",
    "约束": "无"
  },
  {
    "变量ID": "VAR-G05-012",
    "变量名": "g05_expansion_margin",
    "类型": "float",
    "默认值": "0",
    "写入条件": "伸缩扣设置",
    "持久性": "保存",
    "约束": "必须达阈值"
  },
  {
    "变量ID": "VAR-G05-013",
    "变量名": "g05_bridge_balance",
    "类型": "bool",
    "默认值": "false",
    "写入条件": "配重横梁完成",
    "持久性": "保存",
    "约束": "无"
  },
  {
    "变量ID": "VAR-G05-014",
    "变量名": "g05_measure_trials",
    "类型": "int",
    "默认值": "0",
    "写入条件": "三次复测",
    "持久性": "保存",
    "约束": "0-3"
  },
  {
    "变量ID": "VAR-G05-015",
    "变量名": "g05_current_length",
    "类型": "float",
    "默认值": "48.7",
    "写入条件": "复测完成",
    "持久性": "保存",
    "约束": "单位米"
  },
  {
    "变量ID": "VAR-G05-016",
    "变量名": "g05_error_band",
    "类型": "float",
    "默认值": "0.1",
    "写入条件": "误差带完成",
    "持久性": "保存",
    "约束": "单位米"
  },
  {
    "变量ID": "VAR-G05-017",
    "变量名": "g05_recheck_minutes",
    "类型": "int",
    "默认值": "3",
    "写入条件": "复测钟设定",
    "持久性": "保存",
    "约束": "单位分钟"
  },
  {
    "变量ID": "VAR-G05-018",
    "变量名": "g05_permission_height",
    "类型": "bool",
    "默认值": "false",
    "写入条件": "高度节点",
    "持久性": "保存",
    "约束": "管理员权限1"
  },
  {
    "变量ID": "VAR-G05-019",
    "变量名": "g05_permission_capacity",
    "类型": "bool",
    "默认值": "false",
    "写入条件": "供水节点",
    "持久性": "保存",
    "约束": "管理员权限2"
  },
  {
    "变量ID": "VAR-G05-020",
    "变量名": "g05_permission_tolerance",
    "类型": "bool",
    "默认值": "false",
    "写入条件": "误差节点",
    "持久性": "保存",
    "约束": "管理员权限3"
  },
  {
    "变量ID": "VAR-G05-021",
    "变量名": "g05_permission_route",
    "类型": "bool",
    "默认值": "false",
    "写入条件": "路线节点",
    "持久性": "保存",
    "约束": "管理员权限4"
  },
  {
    "变量ID": "VAR-G05-022",
    "变量名": "g05_windcut_off",
    "类型": "bool",
    "默认值": "false",
    "写入条件": "控制器维修",
    "持久性": "保存",
    "约束": "无"
  },
  {
    "变量ID": "VAR-G05-023",
    "变量名": "g05_admin_unlocked",
    "类型": "bool",
    "默认值": "false",
    "写入条件": "权限解除",
    "持久性": "跨章保存",
    "约束": "无"
  },
  {
    "变量ID": "VAR-G05-024",
    "变量名": "g05_dynamic_report_valid",
    "类型": "bool",
    "默认值": "false",
    "写入条件": "报告台完成",
    "持久性": "跨章保存",
    "约束": "必须包含三字段"
  },
  {
    "变量ID": "VAR-G05-025",
    "变量名": "g05_resident_authorized",
    "类型": "bool",
    "默认值": "false",
    "写入条件": "居民许可",
    "持久性": "保存",
    "约束": "管理员不可代替"
  },
  {
    "变量ID": "VAR-G05-026",
    "变量名": "g05_world_change_checks",
    "类型": "int",
    "默认值": "0",
    "写入条件": "三项回访",
    "持久性": "保存",
    "约束": "0-3"
  },
  {
    "变量ID": "VAR-G05-027",
    "变量名": "g05_chapter_complete",
    "类型": "bool",
    "默认值": "false",
    "写入条件": "回访完成",
    "持久性": "跨章保存",
    "约束": "解锁G06"
  },
  {
    "变量ID": "VAR-G05-028",
    "变量名": "world_star_core_count",
    "类型": "int",
    "默认值": "3",
    "写入条件": "章节结算",
    "持久性": "跨章保存",
    "约束": "完成后+1"
  },
  {
    "变量ID": "VAR-G05-029",
    "变量名": "player_name",
    "类型": "string",
    "默认值": "星宇",
    "写入条件": "全项目固定",
    "持久性": "跨章保存",
    "约束": "禁止写回小砾"
  }
]
