[
  {
    "变量ID": "VAR-G01-001",
    "变量名": "g01_emergency_light_on",
    "类型": "bool",
    "默认值": "false",
    "写入条件": "恢复应急照明",
    "持久性": "保存",
    "约束": "无"
  },
  {
    "变量ID": "VAR-G01-002",
    "变量名": "g01_qima_online",
    "类型": "bool",
    "默认值": "false",
    "写入条件": "七码芯片安装",
    "持久性": "跨章保存",
    "约束": "无"
  },
  {
    "变量ID": "VAR-G01-003",
    "变量名": "g01_task_log_unlocked",
    "类型": "bool",
    "默认值": "false",
    "写入条件": "打开任务屏",
    "持久性": "跨章保存",
    "约束": "无"
  },
  {
    "变量ID": "VAR-G01-004",
    "变量名": "g01_map_unlocked",
    "类型": "bool",
    "默认值": "false",
    "写入条件": "打开船内地图",
    "持久性": "跨章保存",
    "约束": "无"
  },
  {
    "变量ID": "VAR-G01-005",
    "变量名": "g01_cargo_sealed",
    "类型": "bool",
    "默认值": "false",
    "写入条件": "货舱复压",
    "持久性": "保存",
    "约束": "无"
  },
  {
    "变量ID": "VAR-G01-006",
    "变量名": "g01_star_map_fragments",
    "类型": "int",
    "默认值": "0",
    "写入条件": "拾取星图碎片",
    "持久性": "保存",
    "约束": "0-3"
  },
  {
    "变量ID": "VAR-G01-007",
    "变量名": "g01_star_map_calibrated",
    "类型": "bool",
    "默认值": "false",
    "写入条件": "TUT-MECH-002完成",
    "持久性": "保存",
    "约束": "无"
  },
  {
    "变量ID": "VAR-G01-008",
    "变量名": "g01_rust_ring_signal_found",
    "类型": "bool",
    "默认值": "false",
    "写入条件": "分析求救信号",
    "持久性": "跨章保存",
    "约束": "无"
  },
  {
    "变量ID": "VAR-G01-009",
    "变量名": "g01_route_node_a",
    "类型": "bool",
    "默认值": "false",
    "写入条件": "航线节点A",
    "持久性": "保存",
    "约束": "无"
  },
  {
    "变量ID": "VAR-G01-010",
    "变量名": "g01_route_node_b",
    "类型": "bool",
    "默认值": "false",
    "写入条件": "航线节点B",
    "持久性": "保存",
    "约束": "无"
  },
  {
    "变量ID": "VAR-G01-011",
    "变量名": "g01_thruster_bypass",
    "类型": "bool",
    "默认值": "false",
    "写入条件": "旁路片安装",
    "持久性": "保存",
    "约束": "无"
  },
  {
    "变量ID": "VAR-G01-012",
    "变量名": "g01_route_complete",
    "类型": "bool",
    "默认值": "false",
    "写入条件": "TUT-MECH-003完成",
    "持久性": "保存",
    "约束": "无"
  },
  {
    "变量ID": "VAR-G01-013",
    "变量名": "ability_qima_search",
    "类型": "bool",
    "默认值": "false",
    "写入条件": "搜寻授权",
    "持久性": "跨章保存",
    "约束": "只缩小区域"
  },
  {
    "变量ID": "VAR-G01-014",
    "变量名": "ability_analysis",
    "类型": "bool",
    "默认值": "false",
    "写入条件": "分析授权",
    "持久性": "跨章保存",
    "约束": "只分析已收集证据"
  },
  {
    "变量ID": "VAR-G01-015",
    "变量名": "ability_pathfinding",
    "类型": "bool",
    "默认值": "false",
    "写入条件": "寻路授权",
    "持久性": "跨章保存",
    "约束": "只限已探索节点"
  },
  {
    "变量ID": "VAR-G01-016",
    "变量名": "ability_teleport",
    "类型": "bool",
    "默认值": "false",
    "写入条件": "G01不开放",
    "持久性": "跨章保存",
    "约束": "禁止使用"
  },
  {
    "变量ID": "VAR-G01-017",
    "变量名": "ability_shrink",
    "类型": "bool",
    "默认值": "false",
    "写入条件": "G01不开放",
    "持久性": "跨章保存",
    "约束": "禁止使用"
  },
  {
    "变量ID": "VAR-G01-018",
    "变量名": "ability_clone",
    "类型": "bool",
    "默认值": "false",
    "写入条件": "G01不开放",
    "持久性": "跨章保存",
    "约束": "禁止使用"
  },
  {
    "变量ID": "VAR-G01-019",
    "变量名": "g01_landing_scanned",
    "类型": "bool",
    "默认值": "false",
    "写入条件": "落点扫描",
    "持久性": "保存",
    "约束": "无"
  },
  {
    "变量ID": "VAR-G01-020",
    "变量名": "g01_handoff_to_g02",
    "类型": "bool",
    "默认值": "false",
    "写入条件": "自动存档信标",
    "持久性": "跨章保存",
    "约束": "G02前置条件"
  },
  {
    "变量ID": "VAR-G01-021",
    "变量名": "g01_chapter_complete",
    "类型": "bool",
    "默认值": "false",
    "写入条件": "舱门离舰",
    "持久性": "跨章保存",
    "约束": "解锁G02"
  },
  {
    "变量ID": "VAR-G01-022",
    "变量名": "world_star_core_count",
    "类型": "int",
    "默认值": "0",
    "写入条件": "G01不增加",
    "持久性": "跨章保存",
    "约束": "保持0"
  },
  {
    "变量ID": "VAR-G01-023",
    "变量名": "player_name",
    "类型": "string",
    "默认值": "星宇",
    "写入条件": "全项目固定",
    "持久性": "跨章保存",
    "约束": "禁止写回小砾"
  },
  {
    "变量ID": "VAR-G01-024",
    "变量名": "tutorial_hints_used",
    "类型": "int",
    "默认值": "0",
    "写入条件": "使用提示",
    "持久性": "保存",
    "约束": "统计"
  },
  {
    "变量ID": "VAR-G01-025",
    "变量名": "tutorial_skip_used",
    "类型": "bool",
    "默认值": "false",
    "写入条件": "跳过独立教学机制",
    "持久性": "保存",
    "约束": "不影响剧情"
  }
]