[
  {
    "变量ID": "VAR-G03-001",
    "变量名": "g03_kaka_rescued",
    "类型": "bool",
    "默认值": "false",
    "写入条件": "救援完成",
    "持久性": "保存",
    "约束": "无"
  },
  {
    "变量ID": "VAR-G03-002",
    "变量名": "g03_reverse_belt_scanned",
    "类型": "bool",
    "默认值": "false",
    "写入条件": "扫描控制箱",
    "持久性": "保存",
    "约束": "无"
  },
  {
    "变量ID": "VAR-G03-003",
    "变量名": "g03_need_cards_count",
    "类型": "int",
    "默认值": "0",
    "写入条件": "验证需求卡",
    "持久性": "保存",
    "约束": "0-4"
  },
  {
    "变量ID": "VAR-G03-004",
    "变量名": "g03_average_split_failed",
    "类型": "bool",
    "默认值": "false",
    "写入条件": "首次平均分配",
    "持久性": "保存",
    "约束": "必须发生"
  },
  {
    "变量ID": "VAR-G03-005",
    "变量名": "g03_real_demand_table",
    "类型": "bool",
    "默认值": "false",
    "写入条件": "UI-016完成",
    "持久性": "保存",
    "约束": "权限条件"
  },
  {
    "变量ID": "VAR-G03-006",
    "变量名": "g03_cargo_labels_restored",
    "类型": "bool",
    "默认值": "false",
    "写入条件": "UI-017完成",
    "持久性": "保存",
    "约束": "无"
  },
  {
    "变量ID": "VAR-G03-007",
    "变量名": "g03_true_order_found",
    "类型": "bool",
    "默认值": "false",
    "写入条件": "取得真实发货单",
    "持久性": "保存",
    "约束": "无"
  },
  {
    "变量ID": "VAR-G03-008",
    "变量名": "g03_fake_order_created",
    "类型": "bool",
    "默认值": "false",
    "写入条件": "干扰订单生成",
    "持久性": "保存",
    "约束": "权限条件"
  },
  {
    "变量ID": "VAR-G03-009",
    "变量名": "g03_evacuated_people",
    "类型": "int",
    "默认值": "0",
    "写入条件": "撤离节点完成",
    "持久性": "保存",
    "约束": "0-4"
  },
  {
    "变量ID": "VAR-G03-010",
    "变量名": "g03_emergency_cargo_secured",
    "类型": "bool",
    "默认值": "false",
    "写入条件": "固定急救货箱",
    "持久性": "保存",
    "约束": "无"
  },
  {
    "变量ID": "VAR-G03-011",
    "变量名": "g03_belt_direction_fixed",
    "类型": "bool",
    "默认值": "false",
    "写入条件": "方向齿轮完成",
    "持久性": "保存",
    "约束": "无"
  },
  {
    "变量ID": "VAR-G03-012",
    "变量名": "g03_belt_speed_safe",
    "类型": "bool",
    "默认值": "false",
    "写入条件": "带速进入安全区",
    "持久性": "保存",
    "约束": "无"
  },
  {
    "变量ID": "VAR-G03-013",
    "变量名": "g03_diverters_fixed",
    "类型": "int",
    "默认值": "0",
    "写入条件": "四区分流完成",
    "持久性": "保存",
    "约束": "0-4"
  },
  {
    "变量ID": "VAR-G03-014",
    "变量名": "g03_safety_pin_installed",
    "类型": "bool",
    "默认值": "false",
    "写入条件": "保险销安装",
    "持久性": "保存",
    "约束": "无"
  },
  {
    "变量ID": "VAR-G03-015",
    "变量名": "g03_permission_demand",
    "类型": "bool",
    "默认值": "false",
    "写入条件": "需求节点完成",
    "持久性": "保存",
    "约束": "管理员权限1"
  },
  {
    "变量ID": "VAR-G03-016",
    "变量名": "g03_permission_order",
    "类型": "bool",
    "默认值": "false",
    "写入条件": "订单节点完成",
    "持久性": "保存",
    "约束": "管理员权限2"
  },
  {
    "变量ID": "VAR-G03-017",
    "变量名": "g03_permission_logistics",
    "类型": "bool",
    "默认值": "false",
    "写入条件": "运输节点完成",
    "持久性": "保存",
    "约束": "管理员权限3"
  },
  {
    "变量ID": "VAR-G03-018",
    "变量名": "g03_permission_allocation",
    "类型": "bool",
    "默认值": "false",
    "写入条件": "分配节点完成",
    "持久性": "保存",
    "约束": "管理员权限4"
  },
  {
    "变量ID": "VAR-G03-019",
    "变量名": "g03_hunger_controller_off",
    "类型": "bool",
    "默认值": "false",
    "写入条件": "控制器维修完成",
    "持久性": "保存",
    "约束": "无"
  },
  {
    "变量ID": "VAR-G03-020",
    "变量名": "g03_admin_unlocked",
    "类型": "bool",
    "默认值": "false",
    "写入条件": "权限解除",
    "持久性": "跨章保存",
    "约束": "无"
  },
  {
    "变量ID": "VAR-G03-021",
    "变量名": "g03_minimum_medical",
    "类型": "int",
    "默认值": "0",
    "写入条件": "公开分配",
    "持久性": "保存",
    "约束": "必须达阈值"
  },
  {
    "变量ID": "VAR-G03-022",
    "变量名": "g03_minimum_heating",
    "类型": "int",
    "默认值": "0",
    "写入条件": "公开分配",
    "持久性": "保存",
    "约束": "必须达阈值"
  },
  {
    "变量ID": "VAR-G03-023",
    "变量名": "g03_production_allocated",
    "类型": "int",
    "默认值": "0",
    "写入条件": "公开分配",
    "持久性": "保存",
    "约束": "不得超总量"
  },
  {
    "变量ID": "VAR-G03-024",
    "变量名": "g03_reserve_allocated",
    "类型": "int",
    "默认值": "0",
    "写入条件": "公开分配",
    "持久性": "保存",
    "约束": "不得低于阈值"
  },
  {
    "变量ID": "VAR-G03-025",
    "变量名": "g03_public_plan_published",
    "类型": "bool",
    "默认值": "false",
    "写入条件": "UI-019完成",
    "持久性": "跨章保存",
    "约束": "无"
  },
  {
    "变量ID": "VAR-G03-026",
    "变量名": "g03_return_checks",
    "类型": "int",
    "默认值": "0",
    "写入条件": "三项回访",
    "持久性": "保存",
    "约束": "0-3"
  },
  {
    "变量ID": "VAR-G03-027",
    "变量名": "g03_chapter_complete",
    "类型": "bool",
    "默认值": "false",
    "写入条件": "回访完成",
    "持久性": "跨章保存",
    "约束": "解锁G04"
  },
  {
    "变量ID": "VAR-G03-028",
    "变量名": "world_star_core_count",
    "类型": "int",
    "默认值": "1",
    "写入条件": "章节结算",
    "持久性": "跨章保存",
    "约束": "完成后+1"
  },
  {
    "变量ID": "VAR-G03-029",
    "变量名": "player_name",
    "类型": "string",
    "默认值": "星宇",
    "写入条件": "全项目固定",
    "持久性": "跨章保存",
    "约束": "禁止写回小砾"
  }
]