[
  {
    "变量ID": "VAR-G02-001",
    "变量名": "g02_intro_scan_done",
    "类型": "bool",
    "默认值": "false",
    "写入条件": "完成封存脉冲扫描",
    "持久性": "保存",
    "约束": "无"
  },
  {
    "变量ID": "VAR-G02-002",
    "变量名": "g02_almao_rescued",
    "类型": "bool",
    "默认值": "false",
    "写入条件": "救下阿铆",
    "持久性": "保存",
    "约束": "无"
  },
  {
    "变量ID": "VAR-G02-003",
    "变量名": "g02_resource_labels",
    "类型": "int",
    "默认值": "0",
    "写入条件": "扫描三类资源标签",
    "持久性": "保存",
    "约束": "0-3"
  },
  {
    "变量ID": "VAR-G02-004",
    "变量名": "g02_archive_restored",
    "类型": "bool",
    "默认值": "false",
    "写入条件": "电视墙档案恢复",
    "持久性": "保存",
    "约束": "无"
  },
  {
    "变量ID": "VAR-G02-005",
    "变量名": "g02_stable_core_a",
    "类型": "bool",
    "默认值": "false",
    "写入条件": "发动机坑完成",
    "持久性": "保存",
    "约束": "无"
  },
  {
    "变量ID": "VAR-G02-006",
    "变量名": "g02_wave_core",
    "类型": "bool",
    "默认值": "false",
    "写入条件": "发动机坑完成",
    "持久性": "保存",
    "约束": "无"
  },
  {
    "变量ID": "VAR-G02-007",
    "变量名": "g02_stable_core_b",
    "类型": "bool",
    "默认值": "false",
    "写入条件": "电池洞穴完成",
    "持久性": "保存",
    "约束": "无"
  },
  {
    "变量ID": "VAR-G02-008",
    "变量名": "g02_fuses_count",
    "类型": "int",
    "默认值": "0",
    "写入条件": "保险丝拾取",
    "持久性": "保存",
    "约束": "0-3"
  },
  {
    "变量ID": "VAR-G02-009",
    "变量名": "g02_heating_replaced",
    "类型": "bool",
    "默认值": "false",
    "写入条件": "临时供暖稳定",
    "持久性": "保存",
    "约束": "无"
  },
  {
    "变量ID": "VAR-G02-010",
    "变量名": "g02_heating_core_borrowed",
    "类型": "bool",
    "默认值": "false",
    "写入条件": "登记借用",
    "持久性": "保存",
    "约束": "无"
  },
  {
    "变量ID": "VAR-G02-011",
    "变量名": "g02_safe_wire_route",
    "类型": "bool",
    "默认值": "false",
    "写入条件": "MECH-003完成",
    "持久性": "保存",
    "约束": "无"
  },
  {
    "变量ID": "VAR-G02-012",
    "变量名": "g02_magnetic_glove_owned",
    "类型": "bool",
    "默认值": "false",
    "写入条件": "工坊完成",
    "持久性": "跨章保存",
    "约束": "无"
  },
  {
    "变量ID": "VAR-G02-013",
    "变量名": "g02_glove_polarity_fixed",
    "类型": "bool",
    "默认值": "false",
    "写入条件": "MECH-002完成",
    "持久性": "保存",
    "约束": "无"
  },
  {
    "变量ID": "VAR-G02-014",
    "变量名": "g02_doubao_backup_authorized",
    "类型": "bool",
    "默认值": "false",
    "写入条件": "豆包同意借电",
    "持久性": "保存",
    "约束": "不可被强制设为true"
  },
  {
    "变量ID": "VAR-G02-015",
    "变量名": "g02_old_capacitor_owned",
    "类型": "bool",
    "默认值": "false",
    "写入条件": "旧电容柜完成",
    "持久性": "保存",
    "约束": "无"
  },
  {
    "变量ID": "VAR-G02-016",
    "变量名": "g02_permission_recycle",
    "类型": "bool",
    "默认值": "false",
    "写入条件": "登记柱完成",
    "持久性": "保存",
    "约束": "管理员权限1"
  },
  {
    "变量ID": "VAR-G02-017",
    "变量名": "g02_permission_tracking",
    "类型": "bool",
    "默认值": "false",
    "写入条件": "反射标记完成",
    "持久性": "保存",
    "约束": "管理员权限2"
  },
  {
    "变量ID": "VAR-G02-018",
    "变量名": "g02_permission_storage",
    "类型": "bool",
    "默认值": "false",
    "写入条件": "居民内部授权",
    "持久性": "保存",
    "约束": "管理员权限3"
  },
  {
    "变量ID": "VAR-G02-019",
    "变量名": "g02_permission_powercut",
    "类型": "bool",
    "默认值": "false",
    "写入条件": "五塔轮换完成",
    "持久性": "保存",
    "约束": "管理员权限4"
  },
  {
    "变量ID": "VAR-G02-020",
    "变量名": "g02_permission_punish",
    "类型": "bool",
    "默认值": "false",
    "写入条件": "清算扣断开",
    "持久性": "保存",
    "约束": "管理员权限5"
  },
  {
    "变量ID": "VAR-G02-021",
    "变量名": "g02_gate_stable_seconds",
    "类型": "float",
    "默认值": "0",
    "写入条件": "稳定阶段每秒更新",
    "持久性": "临时+检查点",
    "约束": "0-12"
  },
  {
    "变量ID": "VAR-G02-022",
    "变量名": "g02_doubao_safe",
    "类型": "bool",
    "默认值": "true",
    "写入条件": "备用电安全线",
    "持久性": "保存",
    "约束": "为false时自动断开并回退"
  },
  {
    "变量ID": "VAR-G02-023",
    "变量名": "g02_heating_temperature",
    "类型": "float",
    "默认值": "1.0",
    "写入条件": "供暖核心使用期间",
    "持久性": "临时+检查点",
    "约束": "0-1"
  },
  {
    "变量ID": "VAR-G02-024",
    "变量名": "g02_admin_unlocked",
    "类型": "bool",
    "默认值": "false",
    "写入条件": "12秒稳定完成",
    "持久性": "跨章保存",
    "约束": "无"
  },
  {
    "变量ID": "VAR-G02-025",
    "变量名": "g02_return_count",
    "类型": "int",
    "默认值": "0",
    "写入条件": "归还借用资源",
    "持久性": "保存",
    "约束": "0-3"
  },
  {
    "变量ID": "VAR-G02-026",
    "变量名": "g02_chapter_complete",
    "类型": "bool",
    "默认值": "false",
    "写入条件": "三项归还完成",
    "持久性": "跨章保存",
    "约束": "解锁G03"
  },
  {
    "变量ID": "VAR-G02-027",
    "变量名": "world_star_core_count",
    "类型": "int",
    "默认值": "0",
    "写入条件": "章节结算",
    "持久性": "跨章保存",
    "约束": "完成后+1"
  },
  {
    "变量ID": "VAR-G02-028",
    "变量名": "player_name",
    "类型": "string",
    "默认值": "星宇",
    "写入条件": "全项目固定",
    "持久性": "跨章保存",
    "约束": "禁止写回小砾"
  }
]