[
  {
    "变量ID": "VAR-G04-001",
    "变量名": "g04_landing_calibrated",
    "类型": "bool",
    "默认值": "false",
    "写入条件": "真实落点确认",
    "持久性": "保存",
    "约束": "无"
  },
  {
    "变量ID": "VAR-G04-002",
    "变量名": "g04_layer_markers_read",
    "类型": "int",
    "默认值": "0",
    "写入条件": "扫描双路标",
    "持久性": "保存",
    "约束": "0-2"
  },
  {
    "变量ID": "VAR-G04-003",
    "变量名": "g04_dual_coordinate_done",
    "类型": "bool",
    "默认值": "false",
    "写入条件": "UI-020完成",
    "持久性": "保存",
    "约束": "无"
  },
  {
    "变量ID": "VAR-G04-004",
    "变量名": "g04_true_compass_installed",
    "类型": "bool",
    "默认值": "false",
    "写入条件": "真向标安装",
    "持久性": "保存",
    "约束": "无"
  },
  {
    "变量ID": "VAR-G04-005",
    "变量名": "g04_memory_fragments_a",
    "类型": "int",
    "默认值": "0",
    "写入条件": "记忆井找物",
    "持久性": "保存",
    "约束": "0-3"
  },
  {
    "变量ID": "VAR-G04-006",
    "变量名": "g04_memory_source_links_a",
    "类型": "int",
    "默认值": "0",
    "写入条件": "UI-021连接",
    "持久性": "保存",
    "约束": "0-3"
  },
  {
    "变量ID": "VAR-G04-007",
    "变量名": "g04_memory_a_fixed",
    "类型": "bool",
    "默认值": "false",
    "写入条件": "铆钉固定",
    "持久性": "保存",
    "约束": "权限条件"
  },
  {
    "变量ID": "VAR-G04-008",
    "变量名": "g04_reverse_tests",
    "类型": "int",
    "默认值": "0",
    "写入条件": "单步测试",
    "持久性": "保存",
    "约束": "0-4"
  },
  {
    "变量ID": "VAR-G04-009",
    "变量名": "g04_reverse_rule_found",
    "类型": "bool",
    "默认值": "false",
    "写入条件": "规则候选锁定",
    "持久性": "保存",
    "约束": "权限条件"
  },
  {
    "变量ID": "VAR-G04-010",
    "变量名": "g04_reverse_gate_open",
    "类型": "bool",
    "默认值": "false",
    "写入条件": "完整序列完成",
    "持久性": "保存",
    "约束": "无"
  },
  {
    "变量ID": "VAR-G04-011",
    "变量名": "g04_decoy_traits",
    "类型": "int",
    "默认值": "0",
    "写入条件": "峡谷调查",
    "持久性": "保存",
    "约束": "0-3"
  },
  {
    "变量ID": "VAR-G04-012",
    "变量名": "g04_reflective_cloth_installed",
    "类型": "bool",
    "默认值": "false",
    "写入条件": "反光布安装",
    "持久性": "保存",
    "约束": "无"
  },
  {
    "变量ID": "VAR-G04-013",
    "变量名": "g04_true_target_verified",
    "类型": "bool",
    "默认值": "false",
    "写入条件": "验证标记完成",
    "持久性": "保存",
    "约束": "无"
  },
  {
    "变量ID": "VAR-G04-014",
    "变量名": "g04_archive_pages",
    "类型": "int",
    "默认值": "0",
    "写入条件": "档案馆找物",
    "持久性": "保存",
    "约束": "0-4"
  },
  {
    "变量ID": "VAR-G04-015",
    "变量名": "g04_archive_sources_verified",
    "类型": "int",
    "默认值": "0",
    "写入条件": "来源校验",
    "持久性": "保存",
    "约束": "0-4"
  },
  {
    "变量ID": "VAR-G04-016",
    "变量名": "g04_contradiction_marked",
    "类型": "bool",
    "默认值": "false",
    "写入条件": "矛盾片段槽完成",
    "持久性": "保存",
    "约束": "无"
  },
  {
    "变量ID": "VAR-G04-017",
    "变量名": "g04_memory_b_fixed",
    "类型": "bool",
    "默认值": "false",
    "写入条件": "第二组记忆固定",
    "持久性": "保存",
    "约束": "权限条件"
  },
  {
    "变量ID": "VAR-G04-018",
    "变量名": "g04_prediction_links",
    "类型": "int",
    "默认值": "0",
    "写入条件": "案例关系建立",
    "持久性": "保存",
    "约束": "0-4"
  },
  {
    "变量ID": "VAR-G04-019",
    "变量名": "g04_true_entrance_proved",
    "类型": "bool",
    "默认值": "false",
    "写入条件": "预测验证完成",
    "持久性": "保存",
    "约束": "权限条件"
  },
  {
    "变量ID": "VAR-G04-020",
    "变量名": "g04_permission_coordinate",
    "类型": "bool",
    "默认值": "false",
    "写入条件": "真实坐标节点",
    "持久性": "保存",
    "约束": "管理员权限1"
  },
  {
    "变量ID": "VAR-G04-021",
    "变量名": "g04_permission_memory",
    "类型": "bool",
    "默认值": "false",
    "写入条件": "固定记忆节点",
    "持久性": "保存",
    "约束": "管理员权限2"
  },
  {
    "变量ID": "VAR-G04-022",
    "变量名": "g04_permission_reverse",
    "类型": "bool",
    "默认值": "false",
    "写入条件": "反向规则节点",
    "持久性": "保存",
    "约束": "管理员权限3"
  },
  {
    "变量ID": "VAR-G04-023",
    "变量名": "g04_permission_deception",
    "类型": "bool",
    "默认值": "false",
    "写入条件": "欺骗预测节点",
    "持久性": "保存",
    "约束": "管理员权限4"
  },
  {
    "变量ID": "VAR-G04-024",
    "变量名": "g04_mirror_core_stable",
    "类型": "bool",
    "默认值": "false",
    "写入条件": "镜核维修",
    "持久性": "保存",
    "约束": "无"
  },
  {
    "变量ID": "VAR-G04-025",
    "变量名": "g04_admin_unlocked",
    "类型": "bool",
    "默认值": "false",
    "写入条件": "权限解除",
    "持久性": "跨章保存",
    "约束": "无"
  },
  {
    "变量ID": "VAR-G04-026",
    "变量名": "g04_world_change_checks",
    "类型": "int",
    "默认值": "0",
    "写入条件": "三项世界改变验证",
    "持久性": "保存",
    "约束": "0-3"
  },
  {
    "变量ID": "VAR-G04-027",
    "变量名": "g04_chapter_complete",
    "类型": "bool",
    "默认值": "false",
    "写入条件": "回访完成",
    "持久性": "跨章保存",
    "约束": "解锁G05"
  },
  {
    "变量ID": "VAR-G04-028",
    "变量名": "world_star_core_count",
    "类型": "int",
    "默认值": "2",
    "写入条件": "章节结算",
    "持久性": "跨章保存",
    "约束": "完成后+1"
  },
  {
    "变量ID": "VAR-G04-029",
    "变量名": "player_name",
    "类型": "string",
    "默认值": "星宇",
    "写入条件": "全项目固定",
    "持久性": "跨章保存",
    "约束": "禁止写回小砾"
  }
]
